{
  "$schema": "http://json-schema.org/draft-07/schema#",
  "$id": "project-adapter.schema.json",
  "title": "SQL Server Lab Project Adapter",
  "description": "Versionierter Adaptervertrag eines konsumierenden Projekts. Version 0.1-draft: identitaets- und policybezogene Felder plus direkte T-SQL-Entrypoints. Die Package-Katalog-Felder sind fuer den Projektintegrationsvertrag reserviert und werden noch nicht ausgefuehrt.",
  "type": "object",
  "required": [
    "adapterContractVersion",
    "projectId",
    "displayName",
    "supportedLabCoreVersions",
    "requiredCapabilities",
    "supportedSqlVersions",
    "entrypoints",
    "dataClassification",
    "privacyExportPolicy",
    "licenseNotice"
  ],
  "properties": {
    "$schema": {
      "type": "string"
    },
    "adapterContractVersion": {
      "type": "string",
      "pattern": "^\\d+\\.\\d+$",
      "description": "Vertragsversion des Adapters. Der Runtimepfad akzeptiert derzeit nur Major-Version 0; unbekannte Major-Versionen werden mit ADAPTER_UNSUPPORTED_CONTRACT abgelehnt.",
      "x-runtimeStatus": "executable"
    },
    "projectId": {
      "type": "string",
      "pattern": "^[a-z][a-z0-9-]{1,63}$",
      "description": "Stabile, kleingeschriebene Projekt-ID.",
      "x-runtimeStatus": "executable"
    },
    "displayName": {
      "type": "string",
      "minLength": 1,
      "x-runtimeStatus": "executable"
    },
    "description": {
      "type": "string",
      "x-runtimeStatus": "executable"
    },
    "supportedLabCoreVersions": {
      "type": "array",
      "minItems": 1,
      "items": {
        "type": "string",
        "pattern": "^\\d+\\.(x|\\d+)$"
      },
      "description": "Unterstuetzte Lab-Core-Versionen, beispielsweise '0.x'. Der Runtimepfad prueft die eigene Modulversion gegen diese Liste.",
      "x-runtimeStatus": "executable"
    },
    "requiredCapabilities": {
      "type": "array",
      "uniqueItems": true,
      "items": {
        "type": "string",
        "enum": [
          "container-linux",
          "sqlcmd"
        ]
      },
      "description": "Vom Adapter benoetigte Lab-Capabilities. Die Liste ist bewusst klein und waechst mit dem Runtimepfad.",
      "x-runtimeStatus": "executable"
    },
    "supportedSqlVersions": {
      "type": "array",
      "minItems": 1,
      "items": {
        "type": "string",
        "pattern": "^\\d{4}$"
      },
      "description": "Unterstuetzte SQL-Server-Basisversionen. Kein festes Enum; die Werte werden gegen den Versionskatalog und die Zielinstanz geprueft.",
      "x-runtimeStatus": "executable"
    },
    "entrypoints": {
      "type": "object",
      "required": [
        "install"
      ],
      "properties": {
        "preflight": {
          "$ref": "#/definitions/sqlEntrypoint",
          "description": "Read-only T-SQL-Pruefung vor Installation. Das Skript darf keinen Zustand veraendern."
        },
        "install": {
          "$ref": "#/definitions/sqlEntrypoint",
          "description": "Installiert die Projektinhalte in der gebundenen SQL-Instanz."
        },
        "update": {
          "$ref": "#/definitions/sqlEntrypoint",
          "description": "Aktualisiert eine vorhandene Installation ohne Lifecycle-Seiteneffekt."
        },
        "validate": {
          "$ref": "#/definitions/sqlEntrypoint",
          "description": "Prueft eine Installation fachlich; Fehler gelten als PROJECT_ASSERTION_FAILED."
        },
        "cleanup": {
          "$ref": "#/definitions/sqlEntrypoint",
          "description": "Entfernt ausschliesslich projekteigene Objekte."
        }
      },
      "additionalProperties": false,
      "description": "Direkte T-SQL-Entrypoints relativ zum Adapter-Root. Version 0.1 fuehrt ausschliesslich .sql-Dateien aus; PowerShell- oder Binaer-Entrypoints benoetigen einen getrennten Deployment-Unit-Vertrag.",
      "x-runtimeStatus": "executable"
    },
    "targetDatabase": {
      "type": "string",
      "pattern": "^[A-Za-z][A-Za-z0-9_]{0,127}$",
      "default": "master",
      "description": "Datenbankkontext fuer die Entrypoints. Skripte duerfen eigene Datenbanken erzeugen und wechseln.",
      "x-runtimeStatus": "executable"
    },
    "secretInputs": {
      "type": "array",
      "items": {
        "type": "object",
        "required": [
          "name",
          "description"
        ],
        "properties": {
          "name": {
            "type": "string",
            "pattern": "^[A-Za-z][A-Za-z0-9_-]{0,63}$"
          },
          "description": {
            "type": "string",
            "minLength": 1
          }
        },
        "additionalProperties": false
      },
      "description": "Deklarierte Secret-Eingaben ohne Werte. Werte werden ausschliesslich zur Laufzeit gebunden.",
      "x-runtimeStatus": "executable"
    },
    "producedLocalArtifacts": {
      "type": "array",
      "items": {
        "type": "string",
        "minLength": 1
      },
      "description": "Beschreibung lokal erzeugter Artefakte, beispielsweise Datenbanken oder Marker.",
      "x-runtimeStatus": "executable"
    },
    "sqlPackageCatalogs": {
      "type": "array",
      "items": {
        "type": "string",
        "minLength": 1
      },
      "description": "Relative Pfade zu SQL-Package-Katalogen gemaess Projektintegrationsvertrag. Reserviert; der Runtimepfad wertet dieses Feld noch nicht aus.",
      "x-runtimeStatus": "reserved"
    },
    "defaultPackageRefs": {
      "type": "array",
      "items": {
        "type": "string",
        "minLength": 1
      },
      "description": "Standard-Package-Referenzen gemaess Projektintegrationsvertrag. Reserviert.",
      "x-runtimeStatus": "reserved"
    },
    "dataClassification": {
      "type": "string",
      "enum": [
        "SYNTHETIC",
        "PUBLIC_FIXTURE",
        "PUBLIC_REFERENCE"
      ],
      "x-runtimeStatus": "executable"
    },
    "privacyExportPolicy": {
      "type": "string",
      "enum": [
        "NO_AUTOMATIC_EXPORT",
        "SANITIZED_SUMMARY_ONLY"
      ],
      "x-runtimeStatus": "executable"
    },
    "licenseNotice": {
      "type": "string",
      "minLength": 1,
      "description": "Lizenzhinweis oder relativer Pfad zur Lizenzdatei des Projekts.",
      "x-runtimeStatus": "executable"
    },
    "knownLimitations": {
      "type": "array",
      "items": {
        "type": "string",
        "minLength": 1
      },
      "x-runtimeStatus": "executable"
    }
  },
  "additionalProperties": false,
  "definitions": {
    "sqlEntrypoint": {
      "type": "string",
      "minLength": 1,
      "pattern": "^(?!/)(?![A-Za-z]:)(?!\\\\).+\\.sql$",
      "description": "Relativer Pfad zu einer .sql-Datei. Das Schema prueft nur die Form (relativ, .sql-Endung); Pfadsicherheit (keine Traversierung, keine Reparse Points, Containment im Adapter-Root) erzwingt der Resolver.",
      "x-ui": {
        "pathKind": "file",
        "pathBase": "adapter-root",
        "pathScope": "artifact",
        "mustExistAtPlan": true,
        "createdByRuntime": false
      }
    }
  }
}
